{"blobs":[{"bytes":3149,"path":"ruleset/accept.ir.json","sha256":"4ff3a23461fe302763a4a78c170178b2bfef236ae1ff612afbfe56bdc465ea42"},{"bytes":11,"path":"ruleset/costvec.ir.json","sha256":"a46c1282fa50a9e027e1959780262723d0f9750308395af9e3436a92c6f31773"},{"bytes":15,"path":"ruleset/migrate.ir.json","sha256":"db343dd8e9212f18d522b94951fb2c8ce46a1396d4c9349139595dcbf722f4be"},{"bytes":713,"path":"omega/omega_activation_binding_v1.json","sha256":"59b7241a7434a2f1677ae3ccdd7428a18e168c8926c0207e5e50df1a1b200181"}],"bundle_hash":"7c893dad85db63633e263e9e02c337669c2fcfa17198eda7962b9575e57f44b4","format":"meta_core_bundle_v1","kernel_hash":"f563ef18368ba83721b26693eac7b02d4af85ba1036b6669b02c683db6660acf","meta_hash":"92a5ed9065f8303e41b3862562259ceb3f2ba7f707af67912fac2fa6df53201b","migration_hash":"db343dd8e9212f18d522b94951fb2c8ce46a1396d4c9349139595dcbf722f4be","parent_bundle_hash":"960d136a6e4ec2a23f794c673c8a53b8fee982bc1a05a51b518569fccfe07020","proofs":{"proof_bundle_hash":"1bed0a6e97e85575616a9530f6ffcfd9e672b99ef199e2aa9e9d7535daeb9cbb"},"ruleset_hash":"3a5da7c3840e8fd6f9f3f970c13c588e7c87b0c891c167ea180bb9e84dfa9db4","schema_version":"1","state_schema_hash":"53f52882d2931b59ec22fde7d083b25725201b392e5099d19514ddbc425e89ae","toolchain_merkle_root":"cc1886cdadd450cb35ac0654f64d3b97084422d174eda2026166b65809832111"}
