{"blobs":[{"bytes":1847,"path":"ruleset/accept.ir.json","sha256":"e7fe46251f2baef8ed03d3e77c22694cfaa1bafdaec49f00efbdc60d498e848b"},{"bytes":11,"path":"ruleset/costvec.ir.json","sha256":"a46c1282fa50a9e027e1959780262723d0f9750308395af9e3436a92c6f31773"},{"bytes":15,"path":"ruleset/migrate.ir.json","sha256":"db343dd8e9212f18d522b94951fb2c8ce46a1396d4c9349139595dcbf722f4be"},{"bytes":677,"path":"omega/omega_activation_binding_v1.json","sha256":"ab74daafde98af87c1af67b963bec12ce8dc6ac5de3cf17662272747f61a52d0"}],"bundle_hash":"f9f37594551a1022bfa28d664f421f32e32e138da4ec28c4bb686cb688ea98e7","format":"meta_core_bundle_v1","kernel_hash":"f563ef18368ba83721b26693eac7b02d4af85ba1036b6669b02c683db6660acf","meta_hash":"92a5ed9065f8303e41b3862562259ceb3f2ba7f707af67912fac2fa6df53201b","migration_hash":"db343dd8e9212f18d522b94951fb2c8ce46a1396d4c9349139595dcbf722f4be","parent_bundle_hash":"f70b1d5399b3711a91c0eebcc081b5289d508a6e2aa65577826858ea0ba6fb96","proofs":{"proof_bundle_hash":"d965a76b2e3f77e88563a46a92cdda58aac5939514bc6e4f7f7e769a4644bf5f"},"ruleset_hash":"39fe3c9bee355befa8bab1453181fb4451817f82ad698c6576f5b0b9dd231567","schema_version":"1","state_schema_hash":"53f52882d2931b59ec22fde7d083b25725201b392e5099d19514ddbc425e89ae","toolchain_merkle_root":"cc1886cdadd450cb35ac0654f64d3b97084422d174eda2026166b65809832111"}
