{"blobs":[{"bytes":2405,"path":"ruleset/accept.ir.json","sha256":"6e5ed6ffbdbcbccb337603a37a880c6946f28f744a8431bc3251a912a169add8"},{"bytes":11,"path":"ruleset/costvec.ir.json","sha256":"a46c1282fa50a9e027e1959780262723d0f9750308395af9e3436a92c6f31773"},{"bytes":15,"path":"ruleset/migrate.ir.json","sha256":"db343dd8e9212f18d522b94951fb2c8ce46a1396d4c9349139595dcbf722f4be"},{"bytes":716,"path":"omega/omega_activation_binding_v1.json","sha256":"13d099a5e88c84dbd1bd50574207c1dae68e847ed4f226cf8d63323c4f439562"}],"bundle_hash":"24c1204427fcc57d455b0a5ea3b2f57df41ff7edd19fb3762d267f25f9834582","format":"meta_core_bundle_v1","kernel_hash":"f563ef18368ba83721b26693eac7b02d4af85ba1036b6669b02c683db6660acf","meta_hash":"92a5ed9065f8303e41b3862562259ceb3f2ba7f707af67912fac2fa6df53201b","migration_hash":"db343dd8e9212f18d522b94951fb2c8ce46a1396d4c9349139595dcbf722f4be","parent_bundle_hash":"23b3a9b55fdd04f150127c1b0cb64844970e130a83c6ba71af523147c023802c","proofs":{"proof_bundle_hash":"8d99bd51c17d648b809aad3e30af1b235dcfee629535570e5573b67e47862889"},"ruleset_hash":"5c39524c205e8a4ee053750b0f99bb564182556f6db9c0d1a465ffc7bc22e6af","schema_version":"1","state_schema_hash":"53f52882d2931b59ec22fde7d083b25725201b392e5099d19514ddbc425e89ae","toolchain_merkle_root":"cc1886cdadd450cb35ac0654f64d3b97084422d174eda2026166b65809832111"}
