{"blobs":[{"bytes":3986,"path":"ruleset/accept.ir.json","sha256":"a9a4524f138f0c264c0bb7bbd65e055eb4450e5aeceaca8c32f7ded0f42531bc"},{"bytes":11,"path":"ruleset/costvec.ir.json","sha256":"a46c1282fa50a9e027e1959780262723d0f9750308395af9e3436a92c6f31773"},{"bytes":15,"path":"ruleset/migrate.ir.json","sha256":"db343dd8e9212f18d522b94951fb2c8ce46a1396d4c9349139595dcbf722f4be"},{"bytes":708,"path":"omega/omega_activation_binding_v1.json","sha256":"ed658d4c03a0b029b7abd298e9469f5cd757ee5bcb13d2296aad44c3c729ac42"}],"bundle_hash":"408b23ad6b9effdc75cb69fea04ebd0e0cd1a156ba360514c244742faeda8df6","format":"meta_core_bundle_v1","kernel_hash":"f563ef18368ba83721b26693eac7b02d4af85ba1036b6669b02c683db6660acf","meta_hash":"92a5ed9065f8303e41b3862562259ceb3f2ba7f707af67912fac2fa6df53201b","migration_hash":"db343dd8e9212f18d522b94951fb2c8ce46a1396d4c9349139595dcbf722f4be","parent_bundle_hash":"8a9c219c9825608051b5208dc7fd1b0c1cc5b6deb65c6fc53795bae1a7e33ef1","proofs":{"proof_bundle_hash":"7112c9f10114c2087a3397e1b4ea5a58123b0cd55d3fda66e484edd5616c6245"},"ruleset_hash":"ded2086e10138a0bac67014a5c406c33cc9fdd462b2e0d56dce6c8ce9f0ebb3b","schema_version":"1","state_schema_hash":"53f52882d2931b59ec22fde7d083b25725201b392e5099d19514ddbc425e89ae","toolchain_merkle_root":"cc1886cdadd450cb35ac0654f64d3b97084422d174eda2026166b65809832111"}
