{"blobs":[{"bytes":3242,"path":"ruleset/accept.ir.json","sha256":"64b030db9497f14bd621227e272b35b33649e6771d8fd63f5173fcad0c9abe7b"},{"bytes":11,"path":"ruleset/costvec.ir.json","sha256":"a46c1282fa50a9e027e1959780262723d0f9750308395af9e3436a92c6f31773"},{"bytes":15,"path":"ruleset/migrate.ir.json","sha256":"db343dd8e9212f18d522b94951fb2c8ce46a1396d4c9349139595dcbf722f4be"},{"bytes":715,"path":"omega/omega_activation_binding_v1.json","sha256":"42b5ed6accc0d14eec3834071e134d001a84e98e1adf8b08fb8052e5d15f24aa"}],"bundle_hash":"9a9751309598c12aef7d7d735a51498b5a4e5afe4f9e15590667d66a8a7154cf","format":"meta_core_bundle_v1","kernel_hash":"f563ef18368ba83721b26693eac7b02d4af85ba1036b6669b02c683db6660acf","meta_hash":"92a5ed9065f8303e41b3862562259ceb3f2ba7f707af67912fac2fa6df53201b","migration_hash":"db343dd8e9212f18d522b94951fb2c8ce46a1396d4c9349139595dcbf722f4be","parent_bundle_hash":"7c893dad85db63633e263e9e02c337669c2fcfa17198eda7962b9575e57f44b4","proofs":{"proof_bundle_hash":"8063fd4c4746fd8fdd5636b74cc47bfcce844ca9cfe490031337da7f143f7d73"},"ruleset_hash":"c55993342efb08de51671ba6671156362b6ccb09df3845f0bf6870ef732b517a","schema_version":"1","state_schema_hash":"53f52882d2931b59ec22fde7d083b25725201b392e5099d19514ddbc425e89ae","toolchain_merkle_root":"cc1886cdadd450cb35ac0654f64d3b97084422d174eda2026166b65809832111"}
