{"blobs":[{"bytes":731,"path":"ruleset/accept.ir.json","sha256":"981717b1932722588a4e7108cf2227a389e5296ea602dcd64044bc4ba2b460ee"},{"bytes":11,"path":"ruleset/costvec.ir.json","sha256":"a46c1282fa50a9e027e1959780262723d0f9750308395af9e3436a92c6f31773"},{"bytes":15,"path":"ruleset/migrate.ir.json","sha256":"db343dd8e9212f18d522b94951fb2c8ce46a1396d4c9349139595dcbf722f4be"},{"bytes":691,"path":"omega/omega_activation_binding_v1.json","sha256":"06e88f892765bd778cecb16a0a7eb96c3be14c73a96ce08e6c1141735d093493"}],"bundle_hash":"93e075db1cda23196b6d18ce37c3aa2803174295564bafb078a182e5f8ded72c","format":"meta_core_bundle_v1","kernel_hash":"f563ef18368ba83721b26693eac7b02d4af85ba1036b6669b02c683db6660acf","meta_hash":"92a5ed9065f8303e41b3862562259ceb3f2ba7f707af67912fac2fa6df53201b","migration_hash":"db343dd8e9212f18d522b94951fb2c8ce46a1396d4c9349139595dcbf722f4be","parent_bundle_hash":"bd79446d6d7e029832750872c8e4dd392cd9bf9a40bfd3e14d319854f6959251","proofs":{"proof_bundle_hash":"74c17e05e6245852f27ea8b1b124ea70f57b076f0b40e17b2589d4fa19346e56"},"ruleset_hash":"ff65732d2db12544b51b3a8333e5f8857d5db4eca23d177be53b41342a02c182","schema_version":"1","state_schema_hash":"53f52882d2931b59ec22fde7d083b25725201b392e5099d19514ddbc425e89ae","toolchain_merkle_root":"cc1886cdadd450cb35ac0654f64d3b97084422d174eda2026166b65809832111"}
